{
  "run_id": "20261009T101500Z-s42",
  "os": {
    "system": "Linux",
    "release": "x.y-microsoft-standard-WSL2",
    "is_wsl2": true
  },
  "python": "3.11.15",
  "cpu": {
    "model": "cpu-model-ghi-tu-dong",
    "logical_cores": 16
  },
  "ram_total_mb": 31000.0,
  "nvidia": {
    "smi_available": true,
    "driver_version": "driver-ghi-tu-dong",
    "reason": null
  },
  "cuda": {
    "torch_version": "torch-ghi-tu-dong",
    "torch_cuda_runtime": "cuda-ghi-tu-dong",
    "available": true,
    "device_name": "gpu-ghi-tu-dong",
    "capability": "12.0",
    "arch_list": [
      "sm_90",
      "sm_120"
    ],
    "arch_supported": true,
    "reason": null
  },
  "libraries": {
    "mujoco": "3.15.0",
    "myo-sim": "0.2.3",
    "numpy": "2.5.3"
  }
}
