{
  "run_id": "20261009T101500Z-s42",
  "os": {
    "system": "Linux",
    "release": "x.y",
    "is_wsl2": false
  },
  "python": "3.11.15",
  "cpu": {
    "model": null,
    "logical_cores": 12
  },
  "ram_total_mb": null,
  "nvidia": {
    "smi_available": false,
    "driver_version": null,
    "reason": "không tìm thấy nvidia-smi"
  },
  "cuda": {
    "torch_version": null,
    "torch_cuda_runtime": null,
    "available": false,
    "device_name": null,
    "capability": null,
    "arch_list": null,
    "arch_supported": null,
    "reason": "torch chưa cài (extra gpu)"
  },
  "libraries": {
    "mujoco": "3.15.0",
    "myo-sim": "0.2.3",
    "numpy": "2.5.3"
  }
}
